{
  "schema": "io.github.charlesbel.samsung-account.master",
  "schema_version": 1,
  "generation": "synthetic-gen-001",
  "created_at": 1700000000,
  "updated_at": 1700000000,
  "account": {
    "login_id": "synthetic-user@example.com",
    "user_id": "synthetic-uid-12345"
  },
  "installation": {
    "physical_address": "synthetic-physical-addr"
  },
  "identity": {
    "auth_server_url": "https://eu-auth2.samsungosp.com",
    "userauth_token": "synthetic-master-token-xyz"
  }
}
